{
  "schema_version": 1,
  "harness_version": "0.1.0",
  "timestamp": "2026-10-19T10:26:02+00:00",
  "label": "mock-server harness validation",
  "validation_only": true,
  "target": {
    "base_url": "http://127.0.0.1:8099/v1",
    "model": "mock-synthetic",
    "engine": "bench/mock_server.py",
    "quantization": "none"
  },
  "workload": {
    "prompt_words": 64,
    "max_tokens": 32,
    "warmup": 2,
    "requests_per_level": 32,
    "seed": 0
  },
  "environment": {
    "platform": "Windows-10-10.0.26200-SP0",
    "python": "3.11.9",
    "cpu": "Intel64 Family 6 Model 154 Stepping 3, GenuineIntel",
    "cpu_count": 12,
    "gpu": "NVIDIA GeForce RTX 2050, 4096 MiB, 592.00",
    "git_commit": null,
    "httpx": "0.28.1"
  },
  "levels": [
    {
      "concurrency": 1,
      "requests": 32,
      "errors": 0,
      "wall_s": 13.484612500004005,
      "throughput_tok_s": 75.93840757379539,
      "req_s": 2.373075236681106,
      "output_tokens": 1024,
      "ttft_ms": {
        "mean": 54.58778124739183,
        "p50": 54.06930000754073,
        "p95": 60.30579999787733,
        "p99": 64.18550002854317
      },
      "itl_ms": {
        "mean": 11.80844495971659,
        "p50": 11.20069995522499,
        "p95": 15.15680004376918,
        "p99": 18.21200002450496
      },
      "e2e_ms": {
        "mean": 421.2936031217396,
        "p50": 414.9267000029795,
        "p95": 447.4560000235215,
        "p99": 497.40899994503707
      }
    },
    {
      "concurrency": 2,
      "requests": 32,
      "errors": 0,
      "wall_s": 7.571424699970521,
      "throughput_tok_s": 135.24535217315005,
      "req_s": 4.226417255410939,
      "output_tokens": 1024,
      "ttft_ms": {
        "mean": 62.028446882322896,
        "p50": 61.20779999764636,
        "p95": 69.60130005609244,
        "p99": 72.25169998127967
      },
      "itl_ms": {
        "mean": 13.203765423426258,
        "p50": 12.450099980924278,
        "p95": 16.71390002593398,
        "p99": 20.39419999346137
      },
      "e2e_ms": {
        "mean": 472.61708750374964,
        "p50": 470.275700034108,
        "p95": 496.3690000004135,
        "p99": 508.80379998125136
      }
    },
    {
      "concurrency": 4,
      "requests": 32,
      "errors": 0,
      "wall_s": 4.745407600014005,
      "throughput_tok_s": 215.78757533851842,
      "req_s": 6.743361729328701,
      "output_tokens": 1024,
      "ttft_ms": {
        "mean": 80.95089061498584,
        "p50": 80.19159996183589,
        "p95": 96.4191000093706,
        "p99": 96.64599999086931
      },
      "itl_ms": {
        "mean": 16.348616734185565,
        "p50": 15.90220001526177,
        "p95": 19.416099996306002,
        "p99": 20.780100021511316
      },
      "e2e_ms": {
        "mean": 589.9482468721544,
        "p50": 588.1957999663427,
        "p95": 616.8522000079975,
        "p99": 622.8698000195436
      }
    },
    {
      "concurrency": 8,
      "requests": 32,
      "errors": 0,
      "wall_s": 3.3087784000090323,
      "throughput_tok_s": 309.4797765837702,
      "req_s": 9.67124301824282,
      "output_tokens": 1024,
      "ttft_ms": {
        "mean": 116.83171249751467,
        "p50": 111.69779999181628,
        "p95": 154.0388999856077,
        "p99": 158.81749999243766
      },
      "itl_ms": {
        "mean": 22.461046270109364,
        "p50": 21.903800021391362,
        "p95": 26.329799962695688,
        "p99": 28.963499993551522
      },
      "e2e_ms": {
        "mean": 815.0581624940969,
        "p50": 813.6914999922737,
        "p95": 858.026499976404,
        "p99": 858.9509000303224
      }
    },
    {
      "concurrency": 16,
      "requests": 32,
      "errors": 0,
      "wall_s": 2.582861699978821,
      "throughput_tok_s": 396.45947748901796,
      "req_s": 12.389358671531811,
      "output_tokens": 1024,
      "ttft_ms": {
        "mean": 186.77876562651363,
        "p50": 177.44739999761805,
        "p95": 248.95460001425818,
        "p99": 254.1567999869585
      },
      "itl_ms": {
        "mean": 34.505385987769486,
        "p50": 34.205300034955144,
        "p95": 38.605300011113286,
        "p99": 42.899099993519485
      },
      "e2e_ms": {
        "mean": 1260.5059343804896,
        "p50": 1240.7006000285037,
        "p95": 1356.7155000055209,
        "p99": 1361.9213000056334
      }
    }
  ]
}